{"assurances":{"completed_children_integrity_verified":true,"completed_results_reused_in_process_only":true,"explicit_campaign_verifier_remains_semantic":true,"first_pending_failure_fail_closed":true,"network_request_performed":false,"partial_children_remain_semantic":true,"private_or_live_capability_used":false},"bindings":{"campaign_plan_sha256":"d7b1eb16ed5e0a44c9749d7d2da7a8675506baf4186c7e75d0ddfc59cbb0343f","campaign_request_sha256":"fa5644cf2bb77d4e448a5d27f8b57e59be9614cf54e068a2915f500b36b3de5c","capacity_evidence_sha256":"2363e5795c108186764f098e572388c6bf61185f77ab342c07e1fc61b2ac46d0","implementation_identity":"git:60363277432a2bdcfb8d2a23ea05060057eb3aaa","instrument_registry_sha256":"9e78d2db1cebb33d1b1bf328df2dee3ee3ad9f7c3db6b42ae916c9017a0fa733"},"content_sha256":"ba23ddf0e0663d9c569235e989322b28241a9ff2667e2535d46224be535c2c88","evidence_schema":"grid.phase2-history-campaign-resume-performance/v1","generated_at_utc":"2026-08-13T23:56:28.067146Z","limitations":["The first pending failure is a local synthetic HTTP 403 and makes no Bybit network request.","This evidence measures resume traversal and fail-closed handoff, not endpoint latency or throughput.","The campaign remains incomplete with pending candle jobs and does not prove source coverage.","Runtime Landing pages and detailed market identities remain outside GitHub.","This evidence does not close Gate 2 or authorize private endpoints, orders, bots, transfers, or live execution."],"measurement":{"completed_child_verification_mode":"receipt-integrity-without-row-decode-v1","completed_jobs_reused":927,"execute_to_first_pending_failure_ms":1283,"first_pending_client_calls":1,"first_pending_failure_class":"synthetic-http-403-fail-closed","job_count":978,"page_count":43328,"pending_job_count":51,"pending_page_count":2271,"planned_peak_memory_bytes":146800640,"preflight_elapsed_ms":72762,"required_free_bytes":103198759642,"resume_to_first_pending_failure_elapsed_ms":74045},"scope":{"end_ms":1785542340000,"kind_count":2,"month_count":103,"start_ms":1514764800000,"symbol_count":5,"tick_rows_requested":false},"status":"verified-post-merge-history-campaign-resume-performance","storage_policy":{"evidence_contains_account_data":false,"evidence_contains_device_identity":false,"evidence_contains_instrument_identities":false,"evidence_contains_market_values":false,"evidence_contains_runtime_paths":false,"runtime_market_artifacts_committed_to_git":false}}
